{
  "schema_version": "i1_zero_sd_preprocessing_receipt_v1",
  "method": "refplan",
  "species": "synthetic_amur_tiger",
  "cell": "synthetic_amur_tiger__allee__sigma_0p2",
  "arm": "T",
  "regime": "end_to_end",
  "feature_names": [
    "mean",
    "sd",
    "q10",
    "q50",
    "q90",
    "extinct",
    "ctx_prev_obs",
    "ctx_obs",
    "ctx_t",
    "ess_frac"
  ],
  "feature_order_hash": "08969af4a8076733d58755eb8447e6ef7d6b027eb550a577ad986f850df837ee",
  "dtype": "float64",
  "construction_mode": "primary_direct_assignment",
  "per_column": [
    {"index": 0, "name": "mean", "raw_mean": 1.145059664632066, "raw_std": 0.509926259411828, "raw_min": 0.048790164169432014, "raw_max": 1.791759469228055, "constant_mask": false, "offset": 1.145059664632066, "scale": 0.509926259411828, "transformed_constant_value": null, "collinear_with": null},
    {"index": 1, "name": "sd", "raw_mean": 0.0, "raw_std": 0.0, "raw_min": 0.0, "raw_max": 0.0, "constant_mask": true, "offset": 0.0, "scale": 1.0, "transformed_constant_value": 0.0, "collinear_with": null},
    {"index": 2, "name": "q10", "raw_mean": 1.145059664632066, "raw_std": 0.509926259411828, "raw_min": 0.048790164169432014, "raw_max": 1.791759469228055, "constant_mask": false, "offset": 1.145059664632066, "scale": 0.509926259411828, "transformed_constant_value": null, "collinear_with": 0},
    {"index": 3, "name": "q50", "raw_mean": 1.145059664632066, "raw_std": 0.509926259411828, "raw_min": 0.048790164169432014, "raw_max": 1.791759469228055, "constant_mask": false, "offset": 1.145059664632066, "scale": 0.509926259411828, "transformed_constant_value": null, "collinear_with": 0},
    {"index": 4, "name": "q90", "raw_mean": 1.145059664632066, "raw_std": 0.509926259411828, "raw_min": 0.048790164169432014, "raw_max": 1.791759469228055, "constant_mask": false, "offset": 1.145059664632066, "scale": 0.509926259411828, "transformed_constant_value": null, "collinear_with": 0},
    {"index": 5, "name": "extinct", "raw_mean": 0.0, "raw_std": 0.0, "raw_min": 0.0, "raw_max": 0.0, "constant_mask": true, "offset": 0.0, "scale": 1.0, "transformed_constant_value": 0.0, "collinear_with": null},
    {"index": 6, "name": "ctx_prev_obs", "raw_mean": 17.5, "raw_std": 4.6097722286464435, "raw_min": 10.0, "raw_max": 25.0, "constant_mask": false, "offset": 17.5, "scale": 4.6097722286464435, "transformed_constant_value": null, "collinear_with": null},
    {"index": 7, "name": "ctx_obs", "raw_mean": 18.5, "raw_std": 4.6097722286464435, "raw_min": 11.0, "raw_max": 26.0, "constant_mask": false, "offset": 18.5, "scale": 4.6097722286464435, "transformed_constant_value": null, "collinear_with": null},
    {"index": 8, "name": "ctx_t", "raw_mean": 7.5, "raw_std": 4.6097722286464435, "raw_min": 0.0, "raw_max": 15.0, "constant_mask": false, "offset": 7.5, "scale": 4.6097722286464435, "transformed_constant_value": null, "collinear_with": null},
    {"index": 9, "name": "ess_frac", "raw_mean": 1.0, "raw_std": 0.0, "raw_min": 1.0, "raw_max": 1.0, "constant_mask": true, "offset": 1.0, "scale": 1.0, "transformed_constant_value": 0.0, "collinear_with": null}
  ],
  "constant_mask": [false, true, false, false, false, true, false, false, false, true],
  "alias_rank_collapse_map": {
    "arm_o_state_block_rank": 5,
    "arm_t_state_block_rank": 1,
    "aliases": {"2": 0, "3": 0, "4": 0}
  },
  "collinear_groups": [[0, 2, 3, 4]],
  "design_rank": 1,
  "design_condition_number": null,
  "constant_threshold": 1e-8,
  "threshold_comparison": "<=",
  "runtime_constant_tolerance": 1e-6,
  "finite_check_passed": true,
  "preprocessing_artifact_sha256": "4f0fe27a0603def8288d62000b71ea3a85f995714ec959a8ab6e96b941182866",
  "fit_view_sha256": "63d3643dfbd41d877a477f64fefa8f546de2001fe476356e6b9d4d145ea5a3b4",
  "runtime_transform_sha256": "4f0fe27a0603def8288d62000b71ea3a85f995714ec959a8ab6e96b941182866",
  "arm_o_artifact_sha256": "aaaaaaaaaaaaaaaaaaaaaaaaaaaaaaaaaaaaaaaaaaaaaaaaaaaaaaaaaaaaaaaa",
  "arm_t_artifact_sha256": "4f0fe27a0603def8288d62000b71ea3a85f995714ec959a8ab6e96b941182866",
  "fit_runtime_parity_result": "PASS",
  "serialization_parity": {
    "serialized_artifact_sha256": "4f0fe27a0603def8288d62000b71ea3a85f995714ec959a8ab6e96b941182866",
    "runtime_reloaded_artifact_sha256": "4f0fe27a0603def8288d62000b71ea3a85f995714ec959a8ab6e96b941182866",
    "checks": {
      "distinct_reloaded_object": true,
      "serialized_bytes_canonical": true,
      "artifact_sha256": true,
      "output_bits": true,
      "feature_schema": true,
      "dtype": true,
      "constant_mask": true,
      "offset_bits": true,
      "scale_bits": true,
      "alias_map": true,
      "rank_receipt": true
    },
    "result": "PASS"
  },
  "parity_failures": [],
  "maximum_absolute_assigned_sd": 0.0,
  "exact_alias_checks": {"2": true, "3": true, "4": true},
  "refplan_standardized_sd_offsets": {
    "tiger_reference": -2.7018,
    "fox_reference": -2.7348,
    "arm_o": -2.7018,
    "arm_t": 0.0
  },
  "refplan_mismatch_disclosure": {
    "fit_time_sd_mean": 0.1,
    "fit_time_sd_std": 0.03,
    "planner_root_sd": 0.0,
    "arm_o_standardized_offset": -2.7018,
    "arm_t_standardized_offset": 0.0,
    "species": "amur_tiger",
    "arm_t_removes_preexisting_mismatch": true,
    "tiger_reference_offset": -2.7018,
    "fox_reference_offset": -2.7348,
    "registered_species_reference_offset": -2.7018,
    "interpretation_warning": "Arm T may remove a pre-existing train/runtime SD mismatch; the contrast cannot automatically be attributed solely to improved abundance information.",
    "strict_json_roundtrip": "PASS",
    "disclosure_complete": true
  },
  "rng_call_count_parity": true,
  "rng_state_advancement_parity": true,
  "fitted_artifact_hashes": {},
  "available_residual_sigma_values": [],
  "frozen_fit_eligible": false,
  "eligibility_reason": "synthetic primary end-to-end receipt; no learned artifact constructed",
  "model_fit_axis_label": "MODEL-FIT AXIS CHANGED — END-TO-END BUNDLE ONLY",
  "zero_variance_events": [
    {"index": 1, "stage": "synthetic_fit", "std": 0.0, "action": "masked"},
    {"index": 5, "stage": "synthetic_fit", "std": 0.0, "action": "masked_preexisting"},
    {"index": 9, "stage": "synthetic_fit", "std": 0.0, "action": "masked_preexisting"}
  ],
  "parity_result": "PASS"
}
